{
  "id": "study_example_observed_shape_only",
  "class": "performance_dr",
  "title": "SHAPE FIXTURE \u2014 observed ad-library row (not a real teardown)",
  "private": true,
  "platforms": [
    "meta",
    "tiktok"
  ],
  "niches": [
    "saas"
  ],
  "pattern_ids": [
    "pas-pain-stack"
  ],
  "attention_model_ids": [
    "am_pas_pain_stack"
  ],
  "when_to_emulate": [
    "After a real library watch \u2014 replace this fixture"
  ],
  "when_not": [
    "Do not cite this fixture id in client packages"
  ],
  "structure": {
    "duration_s": 24,
    "hook_0_3": "Fill from what you actually saw",
    "beats": [
      {
        "t": "0\u20133s",
        "job": "pain object",
        "note": "from watch"
      },
      {
        "t": "3\u201312s",
        "job": "agitate",
        "note": "from watch"
      },
      {
        "t": "12\u201320s",
        "job": "demo",
        "note": "from watch"
      },
      {
        "t": "20\u201324s",
        "job": "CTA",
        "note": "from watch"
      }
    ],
    "format": "video_timed",
    "timing_observable": true
  },
  "steal": [
    "Cut rate you observed",
    "Time-to-product"
  ],
  "never_copy": [
    "Their lines",
    "Their reviews",
    "Invented CTR"
  ],
  "why_it_works": [
    "Fill from observation",
    "Second lesson from observation"
  ],
  "human_build": [
    {
      "step": 1,
      "action": "Emulate structure for THIS brand; fill human-build log",
      "tools": [
        "human-build-log",
        "finish-the-cut"
      ]
    }
  ],
  "provenance": {
    "observed": true,
    "basis": "ad-library",
    "claim_firewall": "SHAPE FIXTURE ONLY \u2014 replace after a real public-library watch; never invent CTR/ROAS.",
    "observed_date": "YYYY-MM-DD",
    "library_ids": [
      "meta_ad_library"
    ]
  },
  "research_where": {
    "libraries": [
      "meta_ad_library"
    ],
    "search_hints": [
      "replace with your query"
    ],
    "observed_date": "YYYY-MM-DD",
    "what_to_note": "hook type, seconds-to-product, CTA count"
  },
  "source_notes": "Fixture for ingest/lint shape. Not a scrape. Not in public corpus."
}
