{
  "id": "study_fixture_search_text",
  "class": "performance_dr",
  "title": "FIXTURE — Google search text (no video observed)",
  "private": true,
  "platforms": ["google_display", "meta"],
  "niches": ["local_services", "saas", "b2b_services"],
  "pattern_ids": ["local-service-trust", "pas-pain-stack"],
  "attention_model_ids": ["am_local_geo_trust"],
  "when_to_emulate": ["Search / RSA-style text ads", "Vertical-first headlines"],
  "when_not": ["Do not invent 0–3s video timing from this study"],
  "structure": {
    "format": "search_text",
    "timing_observable": false,
    "hook_0_3": "Primary headline names vertical + job (NOT a video 0–3s)",
    "beats": [
      {
        "t": "headline",
        "job": "vertical + offer noun",
        "note": "static search — no seconds"
      },
      {
        "t": "description",
        "job": "mechanism or hours",
        "note": "e.g. 24/7 — still not video"
      },
      {
        "t": "sitelink_a",
        "job": "mechanism path",
        "note": "How it works"
      },
      {
        "t": "sitelink_b",
        "job": "proof path",
        "note": "Reviews — separate from mechanism"
      }
    ]
  },
  "steal": [
    "Vertical-first headline qualification",
    "Sitelinks split mechanism vs proof",
    "Lead with hours when that is the pain"
  ],
  "never_copy": [
    "Competitor brand lines",
    "Invented video beats / 0–3s from search text",
    "Claimed CTR/ROAS"
  ],
  "why_it_works": [
    "Segment-in-headline filters the right clicker",
    "Mechanism and proof as separate sitelinks avoid blend"
  ],
  "human_build": [
    {
      "step": 1,
      "action": "Write RSA headlines/descriptions; do not fabricate a timed cut from this study",
      "tools": ["brief", "claim-ledger"]
    },
    {
      "step": 2,
      "action": "If making video twin, use a video_timed study or attention model — not these beats as seconds",
      "tools": ["emulate-attention-model"]
    }
  ],
  "provenance": {
    "observed": true,
    "basis": "ad-library",
    "claim_firewall": "FIXTURE — search text only; no video/timing/audio observed. Do not invent 0–3s beats.",
    "observed_date": "2026-10-10",
    "library_ids": ["google_ads_transparency"],
    "observed_limits": [
      "NO video observed",
      "NO timing / motion / audio observable",
      "NO video beats claimed — format=search_text"
    ]
  },
  "research_where": {
    "libraries": ["google_ads_transparency"],
    "search_hints": ["vertical receptionist", "search text fixture"],
    "observed_date": "2026-10-10",
    "what_to_note": "headline nouns, sitelink split, hours vs tech lead"
  },
  "source_notes": "Committed fixture for retrieve format projection. Not a scrape of a named brand."
}
